,song_name,song_lyrics
37,Dirty Laundry,"Dirty Laundry LyricsI make my living off the evening news
Just give me something, something I can use
People love it when you lose, they love dirty laundry

Well, I could've been an actor, but I wound up here
I just have to look good, I don't have to be clear
Come and whisper in my ear, give us dirty laundry

Kick 'em when they're up, kick 'em when they're down
Kick 'em when they're up, kick 'em when they're down
Kick 'em when they're up, kick 'em when they're down
Kick 'em when they're up, kick 'em all around

We got the bubble-headed bleach-blonde who comes on at five
She can tell you about the plane crash with a gleam in her eye
It's interesting when people die, give us dirty laundry
Can we film the operation? Is the head dead yet?
You know the boys in the newsroom got a running bet
Get the widow on the set, we need dirty laundry

You don't really need to find out what's going on
You don't really want to know just how far it's gone
Just leave well enough alone, keep your dirty laundry

Kick 'em when they're up, kick 'em when they're down
Kick 'em when they're up, kick 'em when they're down
Kick 'em when they're up, kick 'em when they're down
Kick 'em when they're stiff, kick 'em all around

(Kick 'em when they're up, kick 'em when they're down)
(Kick 'em when they're up, kick 'em when they're down)
(Kick 'em when they're up, kick 'em when they're down)
(Kick 'em when they're stiff, kick 'em all around)

Dirty little secrets, dirty little lies
We got our dirty little fingers in everybody's pie
Love to cut you down to size, we love dirty laundry

We can do the innuendo, we can dance and sing
When it's said and done, we haven't told you a thing
We all know that crap is king, give us dirty laundry
(Kick 'em when they're up, kick 'em when they're down)...Embed"
38,The Girl from Yesterday,"The Girl from Yesterday Lyrics[Verse 1]
It wasn't really sad the way they said good-bye
Or maybe it just hurt so bad she couldn't cry
He packed his things, walked out the door and drove away

[Chorus]
And she became the girl from yesterday

[Verse 2]
He took a plane across the sea
To some foreign land
She stayed at home and tried so hard to understand
How someone who had been so close could be so far away

[Chorus]
And she became the girl from yesterday
[Verse 3]
She doesn't know what's right
She doesn't know what's wrong
She only knows the pain that comes from waiting for so long
And she doesn't count the teardrops
That she's cried while he's away
Because she knows deep in her heart
That he'll be back someday

The light's on in the window, she's waiting by the phone
Talking to a memory that's never coming home
She dreams of his returning and the things that he might say

[Outro]
But, she'll always be the girl from yesterday[x2]Embed"
39,Train Leaves Here This Morning,"Train Leaves Here This Morning Lyrics[Verse 1]
I lost ten points just for being in the right place
At exactly the wrong time
I looked right at the facts there, but I may as well
Have been completely blind

[Chorus 1]
So if you see me walking all alone
Don't look back, I'm just on my way back home
And there's a train, leaves here this morning
And I don't know what I might be on

[Verse 2]
She signed me to a contract
Baby said it would all be so life long
I looked around then for a reason
When there wasn't something more to blame it on
[Chorus 2]
But if time makes a difference while we're gone
Tell me now and I won't be hanging on
And there's a train, leaves here this morning
And I don't know what I might be on

[Verse 3]
""1320 North Columbus"" was the address
That I wrote down on my sleeve
I don't know just what she wanted
It might have been that it was getting time to leave

[Chorus 3]
And I watched as the smoker passed it on
And I laughed when the joker said, ""Lead on""
'Cause there's a train, leaves here this morning
And I don't know what I might be on

[Outro]
There's a train, leaves here this morning
And I don't know what I might be on2Embed"
40,On the Border,"On the Border Lyrics[Verse 1]
Cruising down the center of a two way street
Wondering who is really in the driver's seat
Minding my business along comes big brother
Says, son, you better get on one side or the other

[Chorus]
I'm out on the border, i'm walking the line
Don't you tell me about your law and order
I'm trying to change this water to wine

[Verse 2]
After a hard day, i'm safe at home
Fooling with my baby on the telephone
Out of nowhere somebody cuts in and
Says, ""hmm, you in some trouble boy, we know where you're been.""

[Chorus]
I'm out on the border, I thought this was a private line
Don't you tell me about your law and order
I'm trying to change this water to wine
[Bridge]
Never mind your name, just give us your number, mm
Never mind your face, just show us your card, mm
And we wanna know whose wing are you under
You better step to the right or we can make it hard

[Chorus]
I'm stuck on the border
All I wanted was some peace of mind
Don't you tell me 'bout your law and order
I'm trying to change this water to wine

[Outro]
On the border
On the border
On the border
On the border
On the border
Leave me be , i'm just walking this line
On the border
On the border
All i wanted was some peace of mind, peace of mind
I'm out on the border
On the border
Can't you see i'm trying to change this water to wine
On the border
Don't you tell me 'bout your law and order
Sick and tired of all your law and order
On the border
Sick and tired of it
On the border
I'm the man on the border
On the borderEmbed"
41,I Wish You Peace,"I Wish You Peace Lyrics[Verse]
I wish you peace when the cold winds blow
Warmed by the fire's glow
I wish you comfort in the, the lonely time
And arms to hold you when you ache inside
I wish you hope when things are going bad
Kind words when times are sad
I wish you shelter from the, the raging wind
Cooling waters at the fever's end

[Chorus]
I wish you peace when times are hard
The light to guide you through the dark
And when storms are high and your, your dreams are low

I wish you the strength to let love grow on
I wish you the strength to let love flow

[Chorus]
I wish you peace when times are hard
The light to guide you through the dark
And when storms are high and your, your dreams are low
I wish you the strength to let love grow on
I wish you the strength to let love flowEmbed"
42,James Dean,"James Dean LyricsJames Dean, James Dean
I know just what you mean
James Dean, you said it all so clean
And I know my life would look alright
If I could see it on the silver screen
You were the lowdown rebel if there ever was
Even if you had no cause
James Dean, you said it all so clean
And I know my life would look all right
If I could see it on the silver screen

We'll talk about a low-down bad refrigerator
You were just too cool for school
Sock hop, soda pop, basketball and auto shop
The only thing that got you off was breakin' all the rules
James Dean, James Dean
So hungry and so lean
James Dean, you said it all so clean
And I know my life would look all right
If I could see it on the silver screen
Little James Dean, up on the screen
Wondering who he might be
Along came a Spyder and picked up a rider
And took him down the road to eternity

James Dean, James Dean, you bought it sight unseen
James Dean, James Dean, you bought it sight unseen

You were too fast to live, too young to die, bye-bye
You were too fast to live, too young to die, bye-bye
Bye-bye, bye-bye, bye-bye, bye, bye5Embed"
43,My Man,"My Man Lyrics[Verse 1]
Tell me , how do you feel?
Like you're rolling so fast that you're spinning your wheels?
Don't feel too bad, you're not all along
We're all trying to get along
With everybody else trying to go their way
You're bound to get tripped, and what can you say?
Just go along until they turn out the lights
There's nothing we can do to fight it

[Chorus]
No man's got it made till he's far beyond the pain
And we who must remain go on living just the same

[Verse 2]
I once knew a man, very talented guy
He's sing for the people and people would cry
They knew that his song came from deep down inside
You could hear it in his voice and see it in his eyes
And so he traveled along, touch your heart, then be gone
Like a flower, he bloomed till that old hickory wind
Called him home
[Chorus][x2]

[Outro]
We who must remain go on laughing just the same2Embed"
44,Take It Easy (Live),"Take It Easy (Live) LyricsWell, I'm running down the road tryin' to loosen my load
I've got seven women on my mind
Four that wanna own me, two that wanna stone me
One says she's a friend of mine

Take it easy, take it easy
Don't let the sound of your own wheels drive you crazy
Lighten up while you still can don't even try to understand
Just find a place to make your stand and take it easy

Well, I'm a standing on a corner in Southern California
And such a fine sight to see
It's a girl, my lord, in a flatbed Ford
Slowin' down to take a look at me

Come on, baby, don't say maybe
I gotta know if your sweet love is gonna save me
We may lose and we may win though
But we will never be here again so open up, I'm climbin' in take it easy
Well, I'm running down the road trying to loosen
My load, got a world of trouble on my mind
Lookin' for a lover who won't blow my cover
She's so hard to find

Take it easy, take it easy
Don't let the sound of your own wheels drive you crazy
Come on baby, don't say maybe
I gotta know if your sweet love is gonna save me
Well you know we got it easy
We outta take it easy, yeahEmbed"
45,Hollywood Waltz,"Hollywood Waltz Lyrics[Verse 1]
Springtime, and the acacias are blooming
Southern California will see one more day
Dreamland, and bus'ness is booming
The birds are a singing as I drift away

[Verse 2]
She looks another year older
From too many lovers who used her and ran
But some nights, oh, she looks like an angel
And she's always willing to hold you again

[Chorus]
So give her this dance
She can't be forsaken
Learn how to love her
With all of her faults
She gave more than she's taken
And I'll go down doing the Hollywood Waltz

[Verse 3]
Springtime and the lady is grieving
The lovers just stand there with nothing to say
They got what they wanted
They're packing and leaving
To look for another to love the same way
[Chorus]
So give her this dance
She can't be forsaken
Learn how to love her
With all of her faults
She gave more than she's taken
And I'll go down doing the Hollywood Waltz
The Hollywood Waltz3Embed"
46,Ol’ 55,"Ol’ 55 Lyrics[Chorus 1]
Well, my time went too quickly
I went lickety-splitly out to my old fifty-five
As I pulled away slowly, feeling so holy
God knows I was feeling alive

[Chorus 2]
And now the sun's coming up
I'm riding with lady luck
Freeway cars and trucks
Stars beginning to fade, and I lead the parade
Just a wishing I'd stayed a little longer
Lord, don't you know the feelings getting stronger

[Verse]
Six in the morning, gave me no warning
I had to be on my way
Now the cars are all passing me
Trucks are all flashing me
I'm headed home from your place
[Chorus 2]

[Chorus 1]

[Outro]
And now the sun's coming up, yes it is
I'm riding with lady luck
Freeway cars and trucks
Freeway cars and trucks
Riding with lady luck
Freeway cars and trucks
Riding with lady luck
Freeway cars and trucks
Riding with lady luckEmbed"
47,Long Road Out of Eden,"Long Road Out of Eden Lyrics[Verse 1]
Moon shining down through the palms
Shadows moving on the sand
Somebody whispering the twenty-third psalm
Dusty rifle in his trembling hands
Somebody trying just to stay alive
He got promises to keep
Over the ocean in America
Far away and fast asleep

[Pre-Chorus 1]
Silent stars blinking in the blackness of an endless sky
Cold silver satellites, ghostly caravans passing by
Galaxies unfolding, new worlds being born
Pilgrims and prodigals creeping toward the dawn
[Chorus]
And it's a long road out of Eden

[Verse 2]
Music blasting from an SUV
On a bright and sunny day
Rolling down the interstate
In the good old USA
Having lunch at the petroleum club
Smoking fine cigars and swapping lives
He said, ""Give me another slice of that barbecued brisket!""
""Give me another piece of that pecan pie!""

[Pre-Chorus 2]
Freeways flickering, cell phones chiming a tune
We're riding to utopia, road map says we'll be arriving soon
Captains of the old order clinging to the reins
Assuring us these aches inside are only growing pains

[Chorus]
But it's a long road out of Eden

[Verse 3]
Back home I was so certain
The path was very clear
But now I have to wonder
What are we doing here?
I'm not counting on tomorrow
And I can't tell wrong from right
But I'd give anything to be there in your arms tonight
[Solo]

[Verse 4]
Weaving down the American highway
Through the litter and the wreckage and the cultural junk
Bloated with entitlement, loaded on propaganda
And now we're driving dazed and drunk
Been down the road to Damascus
The road to Mandalay
Met the ghost of Caesar on the Appian way
He said, ""It's hard to stop this binging, once you get a taste""
""But the road to empire is a bloody stupid waste""

[Pre-Chorus 3]
Behold the bitten apple, the power of the tools
But all the knowledge in the world is of no use to fools

[Chorus]
And it's a long road out of Eden2Embed"
48,The Greeks Don’t Want No Freaks,"The Greeks Don’t Want No Freaks Lyrics(Hey!)

[Verse 1]
There was beer all over the dance floor
And the band was playing rhythm and blues
You got down and did the gator and half an hour later
You were barfing all over your girlfriend's shoes

[Chorus 1]
But the Greeks don't want no freaks
The Greeks don't want no freaks
Just put a little smile on them rosy cheeks
Cause the Greeks don't want no freaks
(Gator!!)
(Yeah, woooo.... woo. Aaow!)
[Verse 2]
She was the pride and the passion of Dixie
She did exactly what her daddy had planned
She was perfect little sister until somebody missed her
And they found her in the bushes with the boys in the band

[Chorus 2]
But the Greeks don't want no freaks
No, the Greeks don't want no freaks
So put a great big smile on them rosy cheeks
Cause the Greeks don't want no freaks
No, the Greeks don't want no freaks
Said, the Greeks don't want no freaks

Just put that monster smile on them rosy cheeks
Cause the Greeks don't want no freaks
No, the Greeks don't want no freaks

Ahhaaahh....1Embed"
49,Saturday Night,"Saturday Night Lyrics[Intro]
Ya
One, two, three
Two, two, three

[Verse 1]
Seems like a dream now, it was so long ago
The moon burned so bright and the time went so slow
And I swore that I loved her and gave her a ring
The bluebird was high on the wing

[Chorus]
Whatever happened to Saturday night
Finding a sweetheart and holding her tight?
She said, ""Tell me, oh, tell me, was I all right?""
Whatever happened to Saturday night?
[Verse 2]
The years brought the railroad it ran by my door
Now there's boards on the windows and dust on the floor
And she passes the time at another man's side
And I pass the time with my pride
What a tangled web we weave?
Go around with circumstance
Someone show me how to tell
The dancer from the dance

[Chorus]
Whatever happened to Saturday night
Choosing a friend and losing a fight?
She said, ""Tell me, oh, tell me, are you all right?""
Whatever happened to Saturday night?
Whatever happened to Saturday night?Embed"
50,Hole in the World,"Hole in the World Lyrics[Chorus]
There's a hole in the world tonight
There's a cloud of fear and sorrow
There's a hole in the world tonight
Don't let there be a hole in the world tomorrow

[Verse 1]
They say that anger is just love disappointed
They say that love is just a state of mind
But all this fighting over who is anointed
Oh how can people be so blind?

[Chorus]
There's a hole in the world tonight
There's a cloud of fear and sorrow
There's a hole in the world tonight
Don't let there be a hole in the world tomorrow
[Verse 2]
Oh they tell me there's a place over yonder
Cool water running through the burning sand
Until we we learn to love one another
We will never reach the promised land

[Chorus]
There's a hole in the world tonight
There's a cloud of fear and sorrow
There's a hole in the world tonight
Don't let there be a hole in the world tomorrow
There's a hole in the world tonight
(They say that anger is just love disappointed)
There's a cloud of fear and sorrow
(They say that love is just a state of mind)
There's a hole in the world tonight
(But all this fighting over who will be anointed)
Don't let there be a hole in the world tomorrow
(Oh how can people be so blind?)
There's a hole in the world tonight (Hole in the world)
There's a cloud of fear and sorrow (Fear and sorrow)
There's a hole in the world tonight (Mmm)
Don't let there be a hole in the world tomorrow
There's a hole in the world tonight (There's a hole in the world)
There's a cloud of fear and sorrow (A cloud of fear and sorrow)
There's a hole in the world tonight
Don't let there be a hole in the world tomorrow
(Don't let there be a hole in the world, mmm)
There's a hole in the world tonight (Mmm yeah)
There's a cloud of fear and sorrow
(Oh there's a cloud of fear and sorrow)
There's a hole in the world tonight
(There's a hole in the world tonight)
Don't let there be a hole in the world tomorrow (Mmm)
There's a hole in the world tonight (Mmm)
There's a cloud of fear and sorrow (A cloud of fear and sorrow)
There's a hole in the world tonight (Great big hole in the world)
Don't let there be a hole in the world tomorrow
(Don't let there be a hole in the world)
There's a hole in the world tonight
There's a cloud of fear and sorrow
There's a hole in the world tonight
Don't let there be a hole in the world tomorrowEmbed"
51,How Long,"How Long Lyrics[Verse 1]
Like a blue bird with his heart removed, lonely as a train
I've run just as far as I can run
If I never see the good old days shining in the sun
I'll be doing fine and then some

[Chorus]
How long, how long
Woman will you weep
How long, how long
Rock yourself to sleep

[Verse 2]
Well, I've been doing time in lonesome prison, where the sun doesn't shine
Just outside, the freedom river runs
Out there in that shiny night, with blood hounds on your mind
Don't you know it's the same sad situation?
[Chorus]

[Instrumental]

[Verse 3]
Everybody feels alright you know, I heard some poor fool say (Somebody Ooh)
Everyone is out there on the loose
Well I wish I lived in the land of fools, no one knew my name
But what you get is not quite what you choose

[Chorus]

[Outro]
How long, how long (long and drawn out)
Muddy River runs so deep
How long, how long (long and drawn out)
Good night baby, rock yourself to sleep
Sleep tight baby, rock yourself to sleep
Bye bye baby, rock yourself to sleepEmbed"
52,Certain Kind of Fool,"Certain Kind of Fool Lyrics[Verse]
He was a poor boy, raised in a small family
He kinda had a craving for something no one else could see
They say that he was crazy, the kind that no lady should meet
He ran out to the city and wandered around in the street
He wants to dance, oh yeah
He wants to sing, oh yeah
He wants to see the lights a flashing
And listen to the thundering
He saw it in a window, the mark of a new kind of man
He kind of liked the feeling, so shiny and smooth in his hand
He took it to the country and practiced for days without rest
And then one day he felt it, he knew he could stand with the best
They got respect, oh yeah
He wants the same, oh yeah
And it's a certain kind of fool
Who likes to hear the sound of his own name
A poster on a storefront, the picture of a wanted man
He had a reputation spreading like fire through the land
It wasn't for the money, at least it didn't start that way
It wasn't for the running, but now he's running everydayEmbed"
53,Most of Us Are Sad,"Most of Us Are Sad Lyrics[Chorus]
Most of us are sad
No one lets it show
I've been shadows of myself
How was I to know?

[Verse]
Tell me scarlet sun
What will time allow?
We have brought our children here
Who can save them now?
Oh, Weeping woman try to smile
Like the coming dawn
Most of us are sad it's true
Still we must go on
Love was here today
Oh the sun was bright
I will sing you far away
Love is here tonight

[Chorus]
Most of us are sad
No one lets it show
I've been shadows of myself
How was I to know?1Embed"
54,Visions,"Visions Lyrics[Verse]
Visions, that you stir in my soul
Visions, that will never grow old
Sweet baby, i had some visions of you
If i can't have it all, just a taste will do
Go ahead and live all your fantasies
(Don't you ever think about the other side?)
Helps you get from where you are
To where you want to be
(You and me ought to be taking a ride)
You do the best you can
And you make your mistakes
(If you don't like it, you can say that you tried)
Because all i have to give is whatever it takes
Play on, el chingadero, play on
Play on, el chingadero
Dance, angel, dance until you wear out your blues
(Only thing that's gonna save you now)
Take another chance, you got nothing to lose
(The boy didn't love you anyhow)
Girl, you drive me wild when you do what you do
(Something makes me want to take you down)
If i can't have it all, just a taste will do
Just a taste of youEmbed"
55,Bitter Creek,"Bitter Creek LyricsOnce I was young and so unsure
I'd try any ill to find the cure
An old man told me
Tried to scold me
""Whoa, son, don't wade too deep
In Bitter Creek""
(Bitter Creek)

Out where the desert meets the sky
Is where I go when I wanna hide
Oh, peyote (oh, peyote, oooh...)
She tried to show me (tried to show me)
You know there ain't no cause to weep
At Bitter Creek
(Bitter Creek)

We're gonna hit the road for one last time
We can walk right in and steal 'em blind
All that money (all that money, oooh...)
No more runnin' (no more runnin')
I can't wait to see the old man's face
When I win the race
(Bitter Creek)Embed"
56,No More Cloudy Days,"No More Cloudy Days Lyrics[Verse 1]
Sitting by a foggy window
Staring at the pouring rain
Falling down like lonely teardrops
Memories of love in vain
These cloudy days, make you want to cry
It breaks your heart when someone leaves and you don't know why
I can see that you've been hurting, baby I've been lonely too
I've been out here lost and searching, looking for a girl like you
Now I believe the sun is going to shine
Don't you be afraid to love again, put your hand in mine

[Pre-Chorus]
Baby, I would never make you cry
I would never make you blue
I would never let you down
I would never be untrue
[Chorus]
I know a place where we can go where true love always stays
There's no more stormy nights, no more cloudy days

[Verse 2]
I believe in second chances
I believe in angels, too
I believe in new romances
Baby, I believe in you
These cloudy days are coming to an end
And you don't have to be afraid to fall in love again

[Pre-Chorus]

[Chorus]1Embed"
57,Nightingale,"Nightingale Lyrics[Verse 1]
I'm hanging on to my peace of mind
I just don't know
I'm hanging on to those good times, baby
Just want to let them roll
I'm gonna make it to the light and joy
I'll tell you why
I got a woman who can take me there
The apple of my eye

[Chorus 1]
Oh, whoa, I just don't know
No no, no, no
No, whoa, I love her so

[Verse 2]
Don't let me see that mornin' paper
'Cause I don't need those dues
It's just the same old murder movie
But they call it the news
I'll tell you what would be some story
And what would set me free
Is if the same thing happened to everybody
That just happened to me
[Chorus 2]
Oh, whoa, I just don't know
No no, no, no
No, whoa, I'll never let her go
No no, no

[Verse 3]
And every time I hear somebody
Sneaking up behind
Whoa, I turn around but I still hear that sound
And just when I'm about to lose my mind

[Chorus 3]
Here comes my baby
Singing like a nightingale
Coming my way
Down along that devastation trail
Well, tell the Lord above
She's got a brand of love that cannot fail

[Verse 4]
I'm hanging on to my peace of mind
And that's no lie
I'm hanging on to my special friend
The apple of my eye
The apple of my eye, my inspiration too
She's got a lead on my heart and my soul
And she knows just what to do
[Chorus 3]
Oh, whoa, I just don't know
No no, no, no
No, whoa, I get so low and my mind's about to go

[Chorus 4]
But wait a minute, here comes my baby
Singing like a nightingale
Coming my way
Down along that devastation trail
Well, let the fires burn
And let the floods return, we will prevail

[Outro]
Hanging on to my peace of mind
I just don't know3Embed"
58,It’s Your World Now,"It’s Your World Now Lyrics[Verse 1]
A perfect day, the sun is sinking low
As evening falls, the gentle breezes blow
The time we shared went by so fast
Just like a dream, we knew it couldn't last
But I'd do it all again
If I could, somehow
But I must be leaving soon
It's your world now

[Chorus]
It's your world now
My race is run
I'm moving on
Like the setting sun
No sad goodbyes
No tears allowed
You'll be alright
It's your world now
[Verse 2]
Even when we are apart
You'll always be in my heart
When dark clouds appear in the sky
Remember true love never dies
But first a kiss, one glass of wine
Just one more dance while there's still time
My one last wish, someday, you'll see
How hard I tried and how much you meant to me

[Chorus]
It's your world now
Use well, the time
Be part of something good
Leave something good behind
The curtain falls
I take my bow
That's how it's meant to be

[Outro]
It's your world now[x3]Embed"
