,song_name,song_lyrics
110,Country Comfort,"Country Comfort Lyrics[Verse 1]
Soon the pines will be falling everywhere
Village children fight each other for a share
And the 6:09 goes roaring past the creek
Deacon Lee prepares his sermon for next week
I saw grandma yesterday down at the store
Well, she's really going fine for eighty-four
Well, she asked me if sometime I'd fix her barn
Poor old girl, she needs a hand to run the farm

[Chorus]
And it's good old country comfort in my bones
Just the sweetest sound my ears have ever known
Just an old-fashioned feeling fully-grown
Country comforts in a truck that's going home
[Verse 2]
Down at the well, they got a new machine
The foreman says it cuts man-power by fifteen
Yeah, but that ain't natural, yeah, well, so old Clay would say
You see, he's a horse-drawn man until his dying day

[Chorus][x2]
And it's good old country comfort in my bones
Just the sweetest sound my ears have ever known
Just an old-fashioned feeling fully-grown
Country comforts in a truck that's going back home

[Verse 3]
Now the old fat goose is flying across the sticks
The hedgehogs done in clay between the bricks
And the rocking chairs are creaking on the porch
Across the valley moves the herdsman with his torch

[Chorus]
And it's good old country comfort in my bones
It's the sweetest sound my ears have ever known
Just an old-fashioned feeling fully-grown
Country comforts in a truck that's going home
Oh, country comforts in a truck that's going back home, yes, it is
Country com-comforts in a truck that's going back homeEmbed"
111,Susie (Dramas),"Susie (Dramas) Lyrics[Verse 1]
I got frostbitten in the winter
Ice skating on the river
With my pretty little black-eyed girl
She'd make your darn toes curl just to see her, yeah

[Pre-Chorus]
I got a fringe front on my buggy
I got a frisky little colt in a hurry
And a pretty little black-eyed Susie by by by my side

[Chorus]
Well, she sure knows how to use me
Pretty little black-eyed Susie
Playing hooky with my heart all the time
Living with her funky family
In a derelict old alley
Down by the river where we share a little loving in the moonshine
[Verse 2]
I'm an old hayseed harp player
I'm the hit of the county fair
With my pretty little black-eyed girl
Living proof as she swirls, she's a dancer, yeah

[Pre-Chorus]
I got a fringe front on my buggy
I got a frisky little colt in a hurry
And a pretty little black-eyed Susie by by by my side

[Chorus]
Well, she sure knows how to use me
Pretty little black-eyed Susie
Playing hooky with my heart all the time
Living with her funky family
In a derelict old alley
Down by the river where we share a little loving in the moonshine

[Guitar Solo]

[Chorus]
Well, she sure knows how to use me
Pretty little black-eyed Susie
Playing hooky with my heart all the time, oh
Living with her funky family
In a derelict old alley
Down by the river where we share a little loving in the moonshine
Well, she sure knows how to use me
Pretty little black-eyed Susie
Playing hooky with my heart all the time
Living with her funky family
In a derelict old alley
Down by the river where we share a little loving in the moonshineEmbed"
112,Holiday Inn,"Holiday Inn Lyrics[Verse 1]
Boston at last, and the plane's touching down
Our hostess is handing the hot towels around
From a terminal gate to a black limousine
It's a ten minute ride to the Holiday Inn

[Verse 2]
Boredom's a pastime that one soon acquired
Where you get to the stage where you're not even tired
Kicking your heels till the time comes around
To pick up your bags and head out of town

[Chorus]
Slow down, Joe, I'm a rock and roll man
I've twiddled my thumbs in a dozen odd bands
And you ain't seen nothing till you've been
In a motel, baby, like the Holiday Inn
[Chorus]
Slow down, Joe, I'm a rock and roll man
I've twiddled my thumbs in a dozen odd bands
And you ain't seen nothing till you've been
In a motel, baby, like the Holiday Inn

[Verse 3]
Oh, I don't even know if it's Cleveland or Maine
With the buildings as big and rooms just the same
And the TV don't work and the French fries are cold
And the room service closed about an hour agoEmbed"
113,Razor Face,"Razor Face Lyrics[Verse 1]
Has anybody here seen Razor Face?
I heard he's back, looking for a place, to lay down
Must be getting on
Needs a man who's young to walk him around
Needs a man who's young to walk him around

[Verse 2]
Oh, it must be hard for the likes of you
To get by in a world that you just can't see through
And it looks so cold
How does it feel to know you can't go home
How does it feel to know you can't go home

[Chorus]
Come on, Razor Face, my old friend
I'll meet you down by the truck stop inn
With a bottle of booze in the back of my car
You're a song on the lips of an aging star
Razor Face, ooh! Amazing grace, protects you like a glove
And I'll never learn the reason why I love your Razor Face
[Verse 1]
Has anybody here seen Razor Face?
I heard he's back, and looking for a place, to lay down
Must be getting on
Needs a man who's young to walk him around
Needs a man who's young to walk him around

[Chorus]
Come on, Razor Face, my old friend
I'll meet you down by the truck stop inn
With a bottle of booze in the back of my car
You're a song on the lips of an aging star
Razor Face, ooh! Amazing grace, protects you like a glove
And I'll never learn the reason why I love your Razor Face

[Outro]
I love your Razor Face
I love your Razor Face
Ooh, I love Razor Face
Love your Razor Face
I did love your Razor Face
I love your Razor FaceEmbed"
114,Bitter Fingers,"Bitter Fingers Lyrics[Verse 1]
I'm going on the circuit
I'm doing all the clubs
And I really need a song, boys
To stir those workers up
And get their wives to sing it with me
Just like in the pubs
When I worked the good old pubs in Stepney
Oh, could you knock a line or two
Together for a friend?
Sentimental, tear-inducing
With a happy end
And we need a tune to open
Our season at Southend
Can you help us?
[Chorus]
It's hard to write a song with bitter fingers
So much to prove, so few to tell you why
Those old die-hards in Denmark Street start laughing
At the keyboard player's hollow haunted eyes
It seems to me a change is really needed
I'm sick of tra-la-las and la-de-das (la-de-da...)
No more long days hacking hunks of garbage
Bitter fingers never swung on swinging stars, swinging stars

[Verse 2]
I like the warm blue flame
The hazy heat it brings
It loosens up the muscles
And forces you to sing
You know it's just another hit and run
From the tin pan alley twins
And there's a chance that one day
You might write a standard, lads
So churn them out quick and fast
And we'll still pat your backs
'Cause we need what we can get
To launch another dozen acts
Are you working?

[Chorus]
It's hard to write a song with bitter fingers
So much to prove, so few to tell you why
Those old die-hards in Denmark Street start laughing
At the keyboard player's hollow haunted eyes
It seems to me a change is really needed
I'm sick of tra-la-las and la-de-das (la-de-da...)
No more long days hacking hunks of garbage
Bitter fingers never swung on swinging stars, swinging stars
It's hard to write a song with bitter fingers
So much to prove, so few to tell you why
Those old die-hards in Denmark Street start laughing
At the keyboard player's hollow haunted eyes
It seems to me a change is really needed
I'm sick of tra-la-las and la-de-das (la-de-da...)
No more long days hacking hunks of garbage
Bitter fingers never swung on swinging stars, swinging stars
[Outro]
(La-de-da...)
Swinging stars, swinging stars
It's hard to write a song with bitter fingers
So much to prove, so few to tell you why
Those old die-hards in Denmark-Embed"
115,Another Pyramid,"Another Pyramid Lyrics[ZOSER]
While you've been away cavorting
Matters here have moved apace
Now I need you home supporting
All the plans I've put in place

First of all this means your wedding
You'll recall your future bride
For the way that Pharaoh's heading
Time's no longer on our side

According to the hawk god, Horus
Our most regal invalid
Is not that much longer for us
Build another pyramid!
There are many who'll be tearful
As our leader fades away
But our architects are cheerful
And each dog must have its day

If our country is to flourish
Then my son must take the lead
Be our inspiration, nourish
All our hopes our dreams our creed

Soon our monarch will have filled a
Tomb just like his fathers did
Summon Egypt's greatest builders
Re: another pyramid

[MINISTERS]
Build it, build it
Another pyramid

[ZOSER]
There will be a time for mourning
But for now put plans on hold

[MINISTERS]
Hold
[ZOSER]
For I give the nation warning
That before the corpse is cold

[MINISTERS]
Cold

[ZOSER]
We'll extend fair Egypt's power
Egypt's glory strength and style
We shall have our finest hour
Far beyond the mighty Nile

He must have a vault that's grand by
Any standards, floor to lid
Put five thousand slaves on stand by
Build another pyramid!

[MINISTERS]
Build it, build it
Build it, build it
Build it, build it
Build it-

Build it, build it
Build it-
[ZOSER]
He must have a vault that's grand by
Any standards, floor to lid
Put five thousand slaves on stand by
Build another pyramid!Embed"
116,Rock and Roll Madonna,"Rock and Roll Madonna Lyrics[Verse 1]
If anyone should see me making it down the highway
Breaking all the laws of the land
Well, don't you try to stop me, I'm going her way
And that's the way I'm sure she had it planned

[Chorus]
Well, that's my rock and roll Madonna
She's always been a lady of the road
Well, everybody wants her, and no one ever gets her
Well, the freeway is the only way she knows

[Verse 2]
Well, if she would only slow down for a short time
I'd get to know her just before she leaves
But she's got some fascination for that two-wheel combination
And I swear it's gonna be the death of me
[Chorus]
Well, that's my rock and roll Madonna
She's always been a lady of the road
Well, everybody wants her, and no one ever gets her
Well, the freeway is the only way she knows
(Rock on, baby!)
(Whoo! Yeah, yeah)

[Chorus]
Well, that's my rock and roll Madonna
She's always been a lady of the road
Well, everybody wants her, and no one ever gets her
Well, the freeway is the only way she knows

[Bridge]
Let's get a little bit lower
Let's get a little bit lower
Oh, you're standing alright
Single, baby? Ah, yeah, that's pretty good
Now, is everybody gonna rock on with me?
One more time

[Chorus]
I said, that's my rock and roll Madonna, aw, everybody
She's always been a lady of the road
Well, everybody wants her, but no one ever gets her
Well, the freeway is the only way she knows, yeah1Embed"
117,Amy,"Amy Lyrics[Verse 1]
Tread on my face if you like, little lady
Turn me inside out if you have to, baby
But don't you cross me off your list
Ooh, I am young and I ain't never been kissed
Never been kissed by a lady called Amy

[Verse 2]
You're far out, you're fab and insane
A woman of the world, it's quite plain
My dad told me Amy's your name
Said he'd break my neck if I played your game
But he can bust my head 'cause I, I love you all the same

[Chorus]
Amy, I know you don't have to show your affection
'Cause the big boys like you and to you, I'm an infection
So if you don't want me around
I think I'll run along and drown
You can't want this bum in town, Amy
[Electric Violin Solo]

[Chorus]
Amy, I know you don't have to show your affection
'Cause the big boys like you and to you, I'm an infection
So if you don't want me around
I think I'll run along and drown
You can't want this bum in town, Amy

[Verse 3]
I'm beaten on the streets because I loves you
I watch you go to work in the summer
I don't whistle at you down the street
I would if I could but I can't whistle, you see

[Outro]
Amy, I may not be James Dean
Amy, I may not be nineteen
And I may still be in romper boots and jeans
But ooh, Amy, you're the girl that wrecks my dreams

Amy, I may not be James Dean
Amy, I may not be nineteen
And I may still be in romper boots and jeans
But ooh, Amy, you're the girl that wrecks my dreams1Embed"
118,Texan Love Song,"Texan Love Song Lyrics[Verse 1]
I heard from a friend you'd been messing around
With a cute little thing I'd been dating uptown
Well I don't know if I like that idea much
Well you'd better stay clear I might start acting rough
You out of town guys sure think you're real keen
Think all of us boys here are homespun and green
But that's wrong my friend so get this through your head
We're tough and we're Texan with necks good and red

[Chorus]
So it's Ki yi yippie yi yi
You long hairs are sure gonna die
Our American home was clean till you came
And kids still respected the president's name
And the eagle still flew in the sky
Hearts filled with national pride
Then you came along with your drug-crazy songs
Goddammit you're all gonna die
[Verse 2]
How dare you sit there and drink all our beer
Oh it's made for us workers who sweat spit and swear
The minds of our daughters are poisoned by you
With your communistic politics and them negro blues
Well I'm gonna quit talking and take action now
Run all of you fairies clean out of this town
Oh I'm dog tired of watching you mess up our lives
Spending the summertime naturally high

[Chorus]
So it's Ki yi yippie yi yi
You long hairs are sure gonna die
Our American home was clean till you came
And kids still respected the president's name
And the eagle still flew in the sky
Hearts filled with national pride
Then you came along with your drug-crazy songs
Goddammit you're all gonna die
Goddammit you're all gonna die
Oh Lord Goddammit you're all gonna die
Listen now2Embed"
119,Where to Now St. Peter?,"Where to Now St. Peter? Lyrics[Verse 1]
I took myself a blue canoe
And I floated like a leaf
Dazzling, dancing half enchanted
In my Merlin sleep
Crazy was the feeling
Restless were my eyes
Insane, they took the paddles
My arms they paralyzed

[Chorus]
So where to now, St. Peter?
If it's true, I'm in your hands
I may not be a Christian
But I've done all one man can
I understand I'm on the road
Where all that was is gone
So where to now, St. Peter?
Show me which road I'm on
Which road I'm on
[Verse 2]
It took a sweet young foreign gun
This lazy life is short
Something for nothing always ending
With a bad report
Dirty was the daybreak
Sudden was the change
In such a silent place as this
Beyond the rifle range

[Chorus]

[Outro]
I took myself a blue canoe2Embed"
120,Goodbye,"Goodbye LyricsAnd now that it's all over
The birds can nest again
I'll only snow when the sun comes out
I'll shine only when it starts to rain

And if you want a drink
Just squeeze my hand
And wine will flow into the land
And feed my lambs

For I am a mirror
I can reflect the moon
I will write songs for you
I'll be your silver spoon

I'm sorry I took your time
I am the poem that doesn't rhyme
Just turn back a page
I'll waste away
I'll waste away
I'll waste away
I'll waste away
I'll waste away
I'll waste awayEmbed"
121,Thank You for All Your Loving,"Thank You for All Your Loving Lyrics[Verse 1]
Oh, pity me
I'm so alone and so blue
My friends have all gone away
Their friendliness too

[Pre-Chorus]
It was I on my own
With no need to belong
And I wanted to die
That's when you came along

[Chorus]
And thank you for all of your loving
Thank you for all of your tears
Thank you for all of your kindness
Thank you for being here
[Verse 2]
What a difference it made
My life has started again
And if you go away
It just won't be the same

[Pre-Chorus]
It's hard to say what I feel
When I'm by your side
You're there when I'm worried
All my troubles, in you I confide

[Chorus]
And thank you for all of your loving
Thank you for all of your tears
Thank you for all of your kindness
Thank you for being here

[Verse 1]
Oh, pity me
So alone and so blue
My friends have all gone away
Their friendliness too

[Pre-Chorus]
It was I on my own
With no need to belong
And I wanted to die
That's when you came along
[Chorus]
And thank you for all of your loving
Thank you for all of your tears
Thank you for all of your kindness
Thank you for being here

[Outro]
Thank you for all of your loving
Thank you for all of your loving
Thank you for all of your loving
Thank you for all of your loving
Thank you for all of your lovingEmbed"
122,Elton’s Song,"Elton’s Song Lyrics[Verse 1]
Staring all alone and your grace and style
Cut me to the bone with your razor blade smile
I watched you playing pool
It's all around the school that I love you
I love your gypsy hair and dark brown eyes
Always unprepared for your pointed replies
Cynical and lean
I lie awake and dream about you

[Chorus]
If you only knew what I'm going through
Time and again I get ashamed to say your name
It's hard to grin and bear when you're standing there
My lips are dry, I catch your eye and look away
[Verse 2]
Sitting in my room, I've got it bad
Crying for the moon, they think I'm mad
They say it isn't real but I know what I feel and I love you

[Chorus]
If you only knew what I'm going through
Time and again I get ashamed to say your name
It's hard to grin and bear when you're standing there
My lips are dry, I catch your eye and look away

[Outro]
Sitting in my room, I've got it bad
Crying for the moon, they think I'm mad
But I would give my life for a single night beside youEmbed"
123,Your Sister Can’t Twist (But She Can Rock’n’ Roll),"Your Sister Can’t Twist (But She Can Rock’n’ Roll) Lyrics[Verse 1]
I could really get off being in your shoes
I used to be stone sold on rhythm and blues
A heard of a place at the back of town
Where you really kick the shit when the sun goes down

[Pre-Chorus]
I really got buzzed when your sister said
""Throw away them records `cause the blues is dead
Let me take you, honey, where the scene's on fire""
And tonight I learned for certain that the blues expired

[Chorus]
Oh, your sister can't twist but she can rock and roll
She out-bucks the broncos in the rodeo-do
She's only sixteen but it's plain to see
She can pull the wool over little old me
Your sister can't twist but she can rock and roll
Your sister can't twist but she got more soul than me
[Verse 2]
Somebody help me because the bug bit me
Now I'm in heaven with the aching feet
But I'll be back tonight where the music plays
And your sister rocks all my blues away

[Pre-Chorus]
I really got buzzed when your sister said
""Throw away them records `cause the blues is dead
Let me take you, honey, where the scene's on fire""
And tonight I learned for certain that the blues expired

[Chorus]
Oh, your sister can't twist but she can rock and roll
She out-bucks the broncos in the rodeo-do
She's only sixteen but it's plain to see
She can pull the wool over little old me
Your sister can't twist but she can rock and roll
Your sister can't twist but she got more soul than me

[Instrumental Break]

[Chorus]
Oh, your sister can't surf but she can rock and roll
She out-bucks the broncos in the rodeo-do
She's only sixteen but it's plain to see
She can pull the wool over little old me
Your sister can't twist but she can rock and roll
Your sister can't twist but she got more soul than me
[Chorus]
Oh, your sister can't twist but she can rock and roll
She out-bucks the broncos in the rodeo-do
She's only sixteen but it's plain to see
She can pull the wool over little old me
Your sister can't twist but she can rock and roll
Your sister can't twist but she got more soul than meEmbed"
124,Mama Can’t Buy You Love,"Mama Can’t Buy You Love Lyrics[Verse 1]
Baby, so they give you anythin'
Darlin', all the joy money can bring
Baby, do they bring you happiness
Darlin', you're no different from the rest

[Pre-Chorus]
Can't you see that it's love you really need
Take my hand, and I'll show what a love could be
Before it's too late

[Chorus]
Mama don't want you, daddy don't want you
Give it up, baby, baby, mama can't buy you love
Mama don't want you, daddy don't need you
Give it up, baby, baby, mama can't buy you love
[Verse 2]
Baby, fancy friends show you a smile
Darlin', rich relations for a while
Baby, I can only give you love
Darlin', a-this old heart should be enough

[Pre-Chorus]
All I need is a chance to make you mine
Let me in, oh, I'll change the way you feel inside
Before it's too late

[Chorus]
Mama don't want you, daddy don't want you
Give it up, baby, baby, mama can't buy you love
Mama don't want you, daddy don't need you
Give it up, baby, baby, mama can't buy you love

[Chorus]
Mama don't want you, daddy don't want you
Give it up, baby, baby, mama can't buy you love
Mama don't want you, daddy don't need you
Give it up, baby, baby, mama can't buy you love

[Chorus]
Mama don't want you, daddy don't want you
Give it up, baby, baby, mama can't buy you love
Mama don't want you, daddy don't need you
Give it up, baby, baby, mama can't buy you love
[Chorus]
Mama don't want you, daddy don't want you
Give it up, baby, baby, mama can't buy you love
Mama don't want you, daddy don't need you
Give it up, baby, baby, mama can't buy you love

[Chorus]
Mama don't want you, daddy don't want you
Give it up, baby, baby, mama can't buy you love
Mama don't want you, daddy don't need you
Give it up, baby, baby, mama can't buy you love1Embed"
125,Kiss the Bride,"Kiss the Bride Lyrics[Verse 1]
Well, she looked a peach in the dress she made
When she was still her mama's little girl
And when she walked down the aisle, everybody smiled
At her innocence and curls
And when the preacher said, ""Is there anyone here
Got a reason why they shouldn't wed?""

[Pre-Chorus]
I shoulda stuck up my hand
I shoulda got up to stand
And this is what I should have said

[Chorus]
I wanna kiss the bride, yeah!
I wanna kiss the bride, yeah!
Long before she met him, she was mine, mine, mine
Don't say, ""I do"", say, ""bye, bye, bye""
And lemme kiss the bride, yeah!
I wanna kiss the bride, yeah!
[Verse  2]
Underneath her veil, I could see a tear
Tricklin' down her pretty face
And when he slipped on the ring, I knew everything
Would never be the same again
But if the groom woulda known, he'd have had a fit
About his wife and the things we did

[Pre-Chorus]
And what I planned to say
Yeah, on her weddin' day
Well, I thought it, but I kept it hid

[Chorus]
I wanna kiss the bride, yeah!
I wanna kiss the bride, yeah!
Long before she met him, she was mine, mine, mine
Don't say, ""I do"", say, ""bye, bye, bye""
And lemme kiss the bride, yeah!
I wanna kiss the bride, yeah!

[Chorus]
Oh, I wanna kiss the bride, yeah!
I wanna kiss the bride, yeah!
Long before she met him, she was mine, mine, mine
Don't say, ""I do"", say, ""bye, bye, bye""
And lemme kiss the bride, yeah!
I wanna kiss the bride, yeah!
[Outro]
I wanna kiss the bride, yeah!
I wanna kiss the bride, yeah!
I wanna kiss the bride, yeah!Embed"
126,Too Low for Zero,"Too Low for Zero Lyrics[Verse 1]
Six o'clock alarm
I get the wake up call
Let that sucker jingle-jangle
Ring right off the wall
I'm too low for zero
I'm too tired to work
Tied one on with a friend last night
And wound up losing my shirt

[Chorus]
I'm too low for zero
I'm on a losing streak
I got myself in a bad patch lately
I can't seem to get much sleep
I'm too low for zero
I wind up counting sheep
Nothing seems to make much sense
It's all just Greek to me
You know I'm too low, too low, too low for zero
You know I'm too low, too low, too low for zero
[Verse 2]
Cutting out cups of coffee
Switching off the late night news
Putting the cat out two hours early
It isn't any use
I'm too low for zero
Insomnia attacks
Watching flies with my eyes till sunrise
It's daylight when I hit the sack

[Chorus]
I'm too low for zero
I'm on a losing streak
I got myself in a bad patch lately
I can't seem to get much sleep
I'm too low for zero
I wind up counting sheep
Nothing seems to make much sense
It's all just Greek to me
You know I'm too low, too low, too low for zero
You know I'm too low, too low, too low for zero

[Chorus]
I'm too low for zero
I'm on a losing streak
I got myself in a bad patch lately
I can't seem to get much sleep
I'm too low for zero
I wind up counting sheep
Nothing seems to make much sense
It's all just Greek to me
You know I'm too low, too low, too low for zero
You know I'm too low, too low, too low for zero
[Outro]
For zero, for zero, for zero
I'm too low for zero
I'm too low for zero
I'm too low for zero
I'm too low for zero
I'm too low for zero
I'm too low for zeroEmbed"
127,Without Question,"Without Question LyricsThe more I learn, the more I see
The less the world impassions me
The hungry heart, the roving eye
Have come to rest, do not apply
The frantic chase, the crazy ride
The thrill has gone, I step aside

And I'd believe in anything were it not for you
Showing me by just existing only this is true
I love you, I love you without question, I love you

The more I want the more I steal
The more I hold the less is real
All worldly things I follow blind
In hope not faith was paid in kind
The line is drawn, the change is made
I come to you, I'm not afraid
And I'd believe in anything were it not for you
Showing me by just existing only this is true
I love you, I love you without question, I love you
I'd believe in anything were it not for you
Showing me by just existing only this is true
I love you, I love you without question, I love youEmbed"
128,Solar Prestige a Gammon,"Solar Prestige a Gammon LyricsOh ma cameo molesting
Kee pa a poorer for tea
Solar prestige a gammon
Lantern or turbert paw kwee

Solar prestige a gammon
Kool kar kyrie kay salmon
Har ring molassis abounding
Common lap kitch sardin a poor floundin

Cod ee say oo pay a loto
My zeta prestige toupay a floored
Ray indee pako a gammon
Solar prestige a pako can nord

Solar prestige a gammon
Kool kar kyrie kay salmon
Har ring molassis abounding
Common lap kitch sardin a poor floundin
Solar prestige a gammon
Kool kar kyrie kay salmon
Har ring molassis abounding
Common lap kitch sardin a poor floundinEmbed"
