,song_name,song_lyrics
416,Heavy Traffic,"Heavy Traffic Lyrics[Verse 1]
Shakey wake up thirsty from a night in the bar
And snake hips Joe is Mr. Cool
Out on the boulevard
The pimp from the Jack of Diamonds
Just got another Jane Doe
She just got off the last bus from Montecedo
Sailor boys find trouble in the alien state
It's one on one from Las Palmas to the Golden Gate
Fly boys on the corner waiting for a ride
For twenty bucks he'll pull the cork on the man inside

[Chorus]
Because we're rolling in heavy traffic
Judy's in the jump seat and Jody's in the bucket
Billy likes to drive and Jackie's just high
And Cindy thinks we're all gonna commit suicide
Because we're rolling in heavy traffic
Yeah we're rolling in heavy traffic
[Verse 2]
Mack he's got his Marlboros tucked up in his sleeve
He's shacked up in his basement making P.C.P
He used to shake the french fries
Down on 12th and Maine
And now he stays up nights on apple juice and cocaine

[Chorus][x2]Embed"
417,Big Man in a Little Suit,"Big Man in a Little Suit Lyrics[Verse 1]
Oh, I've been staying up nights
Thinking 'bout a long flight that could take me home
Or a slow train rolling
Or a big boat floating out there on that lonely ocean
I'm not the man I was
I guess the dark side lost and the sun broke through
I thought I knew it all
I was the next big thing until I thought about you

[Pre-Chorus]
Oh, I was reaching for the stars
When I wasn't even touching you
I was lying to myself, I needed no one's help
Thought I was living proof
[Chorus]
When there's one set of footsteps
No one's gonna fill your shoes
Now I'm looking in the mirror
At a big man in a little suit
I'm a big man in a little suit
It's tight on me, hard on you
It's a short cut but it's a long way home
When you think you can make it on your own
You think you're bulletproof
But what you really are
Is a big man in a little suit

[Instrumental]

[Verse 2]
Oh, I was part of the chain
A face with no name in a place with no soul
By a thief in the night
I was robbed of the light and left with nothing, nothing to hold
I've turned my back on a world like that
I want to get back to loving you
Give me one more chance
Won't you warm the hands of this cold headed fool?

[Pre-Chorus]
I was reaching for the stars
When I wasn't even touching you
I was lying to myself, I needed no one's help
Thought I was living proof
[Chorus]
When there's one set of footsteps
No one's gonna fill your shoes
Now I'm looking in the mirror
At a big man in a little suit
I'm a big man in a little suit
It's tight on me, hard on you
It's a short cut but it's a long way home
When you think you can make it on your own
You think you're bulletproof
But what you really are
Is a big man in a little suit

[Outro]
It's tight on me, hard on you
It's a short cut but it's a long way home
When you think you can make it on your own
You think you're bulletproof
But what you really are
Is a big man in a little suit
Big man in a little suitEmbed"
418,My Baby Loves Lovin’,"My Baby Loves Lovin’ Lyrics[Chorus 1]
My baby loves loving, my baby loves loving
She's got what it takes, and she knows how to use it
My baby loves loving, my baby loves loving
She's got what it takes, and she knows how to use it

[Verse 1]
I was lonely once in this great big world
Just a nowhere man without a girl
Until that lucky day when she came my way
And she smiled at me as if to say

[Chorus 1]

[Chorus 2]
She's the only one, makes me feel so good
Can't believe my love so I knock on wood
All my silent fears seem to fly away
And she smiled at me as if to say
Your baby loves loving, my baby loves loving
She's got what it takes for me

[Bridge]
No more lonely nights just waiting for the telephone to ring
No more lonely days, my baby's taking care of everything
I'm telling you people

[Chorus 1]

[Chorus 2]

[Chorus 1][x2]Embed"
419,It’s Getting Dark In Here,"It’s Getting Dark In Here Lyrics[Verse 1]
It's getting dark in here
Don't want to leave
Shadow's falling
And I believe
Winds picking up
Thing's so unclear
I'm afraid of my shadow
And it's getting dark in here
I'm scared of strangers
On the street
World's so ugly
I can't breath
Moon's so spooky
I'm close to tears
I've lost it all
And it's getting dark in here
[Chorus]
And the wait isn't worth what i'm getting
Sometimes i feel i'm on fire
I've been handed a curse and a blessing
My life's been stripped down to the wire
And i'm trying to get back and hold on
Find someone somewhere who cares
But the sun's always setting on my life
And it's sure getting dark in here

[Verse 2]
Don't talk about angels
Or how i'll be saved
I'm no coward
But i'm not that brave
Rags are blowing
Rain's getting near
I'm done with running
And it's getting dark in here

[Chorus][x2]

[Outro]
Yeah, the sun's always setting on my life
And it's sure getting dark in hereEmbed"
420,Old ’67,"Old ’67 Lyrics[Verse 1]
Hey how about this
A little conversation tonight
Thinking aloud how we struggled to find
Our place in the dizzy heights
Don't often do this
We never really get the chance
Nearly froze to death on oxford street
Now we're sitting in the south of France
Talking through the evening
It's good to shoot the breeze
Just you and me on a balcony
And cicadas singing in the trees

[Chorus]
Old '67 what a time it was
What a time of innocence, what a time we've lost
Raise a glass and have a laugh, have a laugh or two
Here's to old '67 and an older me and you
[Verse 2]
Sentimental twilight
Conversing on those virgin days
Laughing about how the two of us sound
Like a Tennessee wWlliams play
Honest, it's amazing
That we can get together at all
For in between the saddle and the grand piano
We can read the writing on the wall
Talking through the evening
Sitting here side by side
Just you and me on a balcony
It's a little bit funny this feeling inside

[Chorus]Embed"
421,Je Veux De La Tendresse,"Je Veux De La Tendresse LyricsWritten by jean-paul dreau
Released as a b-side in 1983, and on the french album the fox

J'ai trop rêvé dans ma jeunesse
Aujourd'hui j'lance des s.o.s
Et j'fous ma bouteille à la mer
Je cherche amour beaucoup d'tendresse
Calins partout beaucoup d'caresse
Ciel toujours bleu bisous ça presse
Beaucoup d'beaux jours et plus d'hivers
S'abstenir si pas gentillesse

I dreamt too much in my youth

I'm sending out an s.o.s. today
And i throw my bottle into the sea

I'm looking for love and a lot of tenderness

Sweet-talk reassurance from everywhere

I want an everblue sky and kisses right away

Many lovely days and many winters

Are not without gentleness

Tendresse tendresse
J'veux d'la tendresse
J'veux du ciel bleu toujours toujou
J'veux des enfants plein ma maison
Des guitares des rires des chansons
J'veus qu'on s'aime
J'veux plus qu'on me blesse

Tenderness, tenderness

I want some tenderness

I want blue skies always and everyday
I want a house full of children

Guitars, laughter and songs

I want us to love each other

I no longer wish to be hurt

J'revois encore dans les nuages
Des grands bateaux des paysages
Des formes longues des grandes plages
C'était mon seul livre d'images
J'cachais mes rêves dans mon cartable
Entre mes livres et mes crayons
Des mots d'amour sur toutes les pages
J'ai pas grandi j'suis dans l'coton

I can still see in the clouds

The great ships, the landscapes

The long shapes, the big beaches

It was my only book of pictures

I hid my dreams in my briefcase
Between my books and my pencils

Words of love on every page

I did not grow up

I have always been kept from the world

Mais où sont-ils ceux que j'attends
Depuis qu'j'mange plus de sucre d'orge
Quelque part avec des enfants
C'est p't'être ça leur île au trésor
J'voudrais voler vers le soleil
Avec tous ceux que j'aime, qui m'aiment
Voler plus loin qu'le gris du ciel
Du côté où la vie est belle

But where are the ones i'm waiting for

Since the time i had barley sugar

Somewhere with the children

Maybe that is their treasure island

I want to fly towards the sun

With everyone i love and who love me

Fly beyond the grey sky

To a place where life is beautifulEmbed"
422,Johnny B. Goode,"Johnny B. Goode Lyrics[Verse 1]
Deep down in Louisiana close to New Orleans
Way back up in the woods among the evergreens
There stood an log cabin made of earth and wood
Where lived a country boy named Johnny B. Goode
Who never learned to read or write so well
But he could play a guitar just like ringing a bell

[Chorus]
Go go
Go Johnny go go go[x4]
Go go Johnny B. Goode

[Verse 2]
He used to carry his guitar in a gunny sack
Sat beneath the tree by the railroad track
An engineer could see him sitting in the shade
Strumming with the rhythm that the drivers made
The People passing by, they would stop and say
Oh my, how that little country boy could play
His mother told him, someday you will be a man
You will be the leader of a big old band
Many people coming from miles around
To hear you play your music when the sun goes down
And maybe someday your name will be in lights
Saying Johnny B. Goode tonight
[Chorus]Embed"
423,Just Like Noah’s Ark,"Just Like Noah’s Ark Lyrics[Verse 1]
It's just like Noah's ark
There's two of every kind
Pretty girls and boys in drag
Walking a fine thin line
Shaking hands and bussing cheeks
Licking their lips like they could eat
Me alive in a couple of weeks
Yea just like Noah's ark
Italiano promotion men
Chomping a big cigar
Slapping backs and making cracks
About the fags in the bar
Radio boss dipping his nose in a little white packet
You put it out son and we'll all back it
Yea it's just like Noah's ark
[Chorus]
And the waves are crashing round us
But we're ready for the flood
And we don't need a sign like an olive branch
In the beak of a snow white dove
We're not as dumb as we might look
You can't keep us in the dark
With me and you it's two by two just like Noah's ark

[Verse 2]
These four walls have seen
The cockettes and the casters
From San Francisco to Ohio
I've seen beauty and disaster
Cocky young roosters and little chicks
Flashing smiles, shaking them hips
Trying to hook it up for the late night shift
Here in Noah's ark

[Chorus]

[Verse 3]
And we wrote it as we saw it from the centre of the stage
All access to the liars who claim they wrote a page
But for every tiny dancer there's a dog that's had its day
The truth is never quite the same as what the papers say
[Chorus]Embed"
424,I Stop And I Breathe,"I Stop And I Breathe Lyrics[Verse 1]
We are still all right
We took it on the chin
But in the thirteenth hour
No one ever wins
But we're strong enough
Like traffic all tied up
And when the static clears
The radios still buzz

[Chorus]
And I stop and I breathe
Because you wanted me
And I wanted you so bad
And I stop and I breathe
Because I still believe
No one really knows what it is that we have
[Verse 2]
Like blood in a vein
We chased this one down
And in the darkest long night
We turned it all around
And it was coal-dusted snow
That covered the fields
But the corn it still grew
And the injury healed

[Chorus][x2]Embed"
425,Strangers,"Strangers LyricsTwo people caught on a string
A high-wire act above the center ring
While the audience is wondering
If we'll make it back

Two people up on a wire
Overhead and under fire
While the audience enquire
If it's just a knack

Strangers, after all, we find we're strangers
After all this time
We've made the long and the lonely climb
And now we've reached the part
Where we find we're strangers
We were strangers from the start
Two people caught in the tide
On the edge of love and pride
And both afraid to approach the side
And fall again

Two people playing the part
But which is life and which is art
And isn't it a little lateEmbed"
426,Shooting Star,"Shooting Star Lyrics[Verse 1]
I'm still in love with you, oh, shooting star
And when I start to wonder where you are
There you are, there you are, shooting star
You may have seen me at the early show
I sat and watched you from the second row
Oh, you were mine long ago way back when
Even then we both knew you'd go far, oh, shooting star
And with the spotlight shining in your eyes
It's sometimes hard to find your way
But maybe some night you might
Think of me, shooting star
And when that moment comes at last
And you remember who you are

[Chorus]
Here I'll be, shooting star, shooting star[x2]Embed"
427,Ball and Chain,"Ball and Chain Lyrics[Chorus 1]
I got a ball and chain hanging around my heart
You were the one to blame for tearing my world apart
I got a heart so true, you got a heart of ice
A little more love from you, it could have been paradise

[Chorus 2]
I got a ball and chain hanging around my heart
And if it's all the same maybe we should part
And I'm singing do do do
I'm singing do do do

[Bridge]
You had to tie me down inside a cage of doubt
I'm sick of being kicked around so this is where I get out
[Chorus 2]

[Bridge]
Oh oui baby you tried to hold me but you were slowly
Driving me insane
Oh oui baby

[Chorus 1]

[Bridge]
I couldn't take your pain, you couldn't take my love
So I'm going to quit this game `cause baby I've had enough

[Chorus 2]

I got a ball and chain hanging around my heart[x4]

[Outro]
And I'm singing do do do
I'm singing do do doEmbed"
428,I’m Still Standing (One World: Together At Home),"I’m Still Standing (One World: Together At Home) Lyrics[Verse 1]
You could never know what it's like
Your blood, like winter, freezes just like ice
There's a cold, lonely light that shines from you
You'll wind up like the wreck you hide behind that mask you use

[Verse 2]
And did you think this fool would never win?
Look at me, I'm a-coming back again
Got a taste of love in a simple way
You need to know while I'm still standing
You just fade away

[Chorus]
You know I'm still standing better than I ever did
Looking like a true survivor, feeling like a little kid
I'm still standing after all this time
Picking up the pieces of my life without you on my mind
I'm still standing, yeah, yeah, yeah
I'm still standing, yeah, yeah, yeah
[Verse 3]
Once, I never coulda hoped to win
You starting down a road and leaving me again
The threats you made were meant to cut me down
And if our love was just a circus, you'd be a clown by now

[Chorus]
You know I'm still standing better than I ever did
Looking like a true survivor, feeling like a little kid
I'm still standing after all this time
Picking up the pieces of my life without you on my mind
I'm still standing, yeah, yeah, yeah
I'm still standing, yeah, yeah, yeah

[Outro]
I'm still standing, yeah, yeah, yeah
I'm still standing, yeah, yeah, yeah
I'm still standing, yeah, yeah, yeahEmbed"
429,The Tide Will Turn for Rebecca,"The Tide Will Turn for Rebecca LyricsCan you hear the floorboards crying
In a room on the second floor
That used to be owned by someone who's no one
But he don't live there anymore

Only Rebecca clasping her head in her knees
Trying to work out what it's about
And why someone had to leave

But dry up your tears
Stop counting the years
Don't worry what's coming
Forget all your fears

And the tide will turn for Rebecca
And the tide will turn for Rebecca
Her life will change
Her hopes rearrange
Into something that might really matter
She's all alone in a world of her own
With a key that fits her lonely world
You won't need a crowd to shout out aloudEmbed"
430,I Can’t Keep This From You,"I Can’t Keep This From You Lyrics[Verse 1]
I can't keep this from you
I've held it in so long
It's time to tell the truth
Keeping it from you is wrong
I can't keep this from you
It's so simple I'm afraid
When I tell you how I feel
You'll just laugh and call me crazy

[Chorus]
And I can't keep
This love a secret
And I don't want
To go on longing
I just want a chance for me to prove
My love and I can't keep this from you
[Verse 2]
I can't keep this from you
It's hard to breathe in here
I just seem to act the fool
Every time I feel you near
I can't keep this from you
No matter what you say
Anything is better now
Than going through my life this way

[Chorus]

[Verse 3]
And I love every move you make
Can't you hear every heart you break?
And don't you know when I hear your name?
Just the sound of it shoots me down in flames

[Chorus][x2]

[Outro]
I just want a chance for me to prove
My love and I can't keep this from you
Oh no i just can't keep this from youEmbed"
431,Donner Pour Donner,"Donner Pour Donner LyricsWe're no handy silver lining
We're no crime to make the headline news
If it's a matter for decision
You and I can be the ones to choose

Je te donne mes espoirs caches
Je te donne mes incertitudes
Je te donne mes plus grands secrets
La vie c'est deja si complique

Donner pour donner, tout donner
C'est la seule facon d'aimer
Donner pour donner
C'est la seule facon de vivre
C'est la seule facon d'aimer
Pas la peine de vivre enferme
C'est pas la peine
Pas la peine de rester couche
Non c'est pas la peine
Je te donne sans rien demander
La vie, c'est deja si complique

Je te donne mes sourires moqueurs
Je te donne ma force, ma douceur
Je te donne mes secrets fragiles
La vie, c'est deja si difficileEmbed"
432,Dancing in the End Zone,"Dancing in the End Zone LyricsHave you ever had a good time turn bad
When the leaves turn brown
And the shattered glass just splinters
It's days like this that you can't resist
A long tall drink
And a big yellow sun in the winter

And you can go dancing
You can go dancing
You can go dancing
Dancing in the end zone

Did you ever pray you could stay away
Company excluded
From the curse of the family circle
In a big round room on the edge of the moon
There's a shooting star
In a race for the final hurdle
No need to worry, no need to worry
No need to worry when you dance alone
You already made it, you already made it
When you're dancing in the end zoneEmbed"
433,Suit of Wolves,"Suit of Wolves LyricsLooking back in anger
On this dirty little town
It stained your dress carved up my face
Put a wedge between our state of grace

Somethings so young and pretty
Should never be released
We place our bets we take our pick
They wind up in the belly of the beast

And when you can't get what you want
You take anything you can
So I wear this suit of wolves at night
I slip it on how come it feels so right

I get a hungry man
When I can't get what I want
I take anything I can
I wear a suit of wolves
Just across from Friday
The weekend circus rolls
I cross my heart turn on the charm
I say my prayers between two hungry arms

There's a string of dangerous flowers
All around my bed
There's some want rings and some just want
And those who'd like to see me deadEmbed"
434,Can’t Get Over Getting Over Losing You,"Can’t Get Over Getting Over Losing You LyricsMusic by elton john
Released as a uk b-side in 1981

At last i'm over losing you
I've cried so many tears it just ain't true
My eyes are red, my heart is blue
I can't get over getting over losing you

I can't turn back the hands of time
I've come so far, i have to see it through
The trouble is that i still find
I can't get over getting over losing you

I hardly ever think of you
Except in the morning and then in the evening, again in the afternoon
I guess it's true, i'm over the worst
But living's the one thing that ain't rehearsed
But i know that's all behind me now
I'm learning how to live my life anew
And as soon as i discover how
Then i'll get over getting over losing you

I hardly ever think of you, i roll with the punches
I'm taking it easy, i don't play hunches like i used to do
I'm over you now
Still tying to forget you but i don't know how

But at least i'm over losing you
There's only one thing left for me to do
Oh my eyes are red, my heart is blue
I draw the lone on you and me, forget how fine it used to be
And i'll get over getting over losing you
And i'll get over getting over losing youEmbed"
435,I Know the Truth (Duet with Janet Jackson),"I Know the Truth (Duet with Janet Jackson) Lyrics[Verse 1: Elton John]
How have I come to this?
How did I slip and fall?
How did I throw half a lifetime away
Without any thought at all?

This should have been my time
It's over, it never began
Facing a world, for once not on my side
I simply turned and ran

I try to blame it on fortune
Some kind of shift in the stars
But I know the truth and it haunts me
It's flown just a little too far
I know the truth and it mocks me
I know the truth and it shocks me
Oh, it's flown just a little too far, yes

[Verse 2: Janet Jackson]
People have faith in me
I think I once did too
I promise whoever has a hold on our lives
I’ll see the bad times through

This should have been my time
It’s over, it never began
Facing a world, for once not on my side
I simply turn and ran

I try to blame it on fortune
Some kind of twist in my fate
I know the truth and it haunts me
I learned it a little too late

I know the truth and it mocks me
I know the truth and it shocks me
I learned it a little too late

[Elton John & Janet Jackson]
I try to blame it on fortune
Some kind of twist in my fate
But I know the truth and it haunts me
I learned it a little too late
I know the truth and it mocks me
I know the truth and it shocks me
Oh, ho, yet, I learned it a little too lateEmbed"
436,Sitting Doing Nothing,"Sitting Doing Nothing LyricsI'm just sitting doing nothing
Wondering where I should go
People tell me I'm just lazy
Weather or not it's true I don't know

So I'm just sitting doing nothing
Wondering where I should go
Many people that I've encountered
Say they wish that they were free

And I know that secretly
All those people would really like to be me

So even though they tell me I'm idle
Why should I do what they say
For they're in the same place all the time
But I'm only there for a day
So I'm just sitting doing nothingEmbed"
437,Love’s Got A Lot To Answer For,"Love’s Got A Lot To Answer For Lyrics[Verse 1]
Pull my coat around me
Feel the cold wind haunt me
Streets are empty just like me
The murmur of an echo
Seems to come from every window
Is loneliness the same as being free?

[Pre-Chorus]
I guess I must have been dreaming
To think that I believed in you at all
Now I just can't fight it
As the shadow of the night begins to fall

[Chorus]
Love's got a lot to answer for
Oh, I just can't sleep with this feeling anymore
Let the cold night air cool the heat
Of two hearts gone to war
For no matter who wins in the end
Love's got a lot to answer for
[Verse 2]
All I need is darkness
The best of all protection
Freedom's like the stars in the sky
Alone and cold and burning
Each one keeps it's distance
If only we were stars, you and I

[Pre-Chorus]

[Chorus][x2]Embed"
438,I Am Your Robot,"I Am Your Robot Lyrics[Verse 1]
I've been beaming aboard her for a light year
From a strange craft
She's got a subtle touch on the silver key
To a clockwork heart

[Chorus]
I am your robot [2x]
I am your robot man
I am your robot [2x]
I am your robot man

[Verse 2]
You went and flipped the switch and turned me positive
When I was negative
I've been stumbling around like a metal man
On the graveyard shift
[Chorus][2x]

[Bridge]
I am your robot and I'm programmed to love you
My serial number is 44357

[Outro]
I am your robotEmbed"
439,January,"January Lyrics[Verse 1]
Must have been the right month
Must have been a good time
Must have counted every cloud in the sky that night
Every single glass of wine
Must have learned some home truths
Sitting in that cool grass
Must have counted every blade in that emerald field
Every shooting star that passed

[Pre-Chorus]
Should have had a talk with God
Sitting in the great unknown
Watching all the lovers in the world get together
Sitting in Heaven all alone
[Chorus]
And we were love's knot after summer
Tied together in the dead of winter
Wrapped up with spring fever in the air
Bound together in the autumn
Every month means a little something
But January is the month that cares

[Verse 2]
Must have kissed you until I hurt you
Must have been a wild night
Must have rolled in the ashes at the break of day
Rag dolls in the mornin' light
Must have found a secret place
Hiding in our own world
Must have counted every smile on your sweet, sweet lips
Every single sound we heard

[Pre-Chorus]

[Chorus]Embed"
440,Satellite,"Satellite Lyrics[Verse 1]
Well you come on like a comet, ideas in your head
Starving for affection, waiting to be fed
Crazy like a full moon, eyes open wide
Taking in everything you need to stay alive

[Pre-Chorus]
Who leads who, who knows where
If you leave me now will I see you again

[Chorus]
I'm telling you love bites
Like a satellite
Going round and round
It's something, something you can't fight
Oh in the daylight
And even in the dark night
I want you to surround me
Surround me like a satellite
[Verse 2]
Oh you move like a shadow of your own design
Do you want to trap me in between the lines
I don't walk on water if you think I can
If you want a miracle call up a Superman

[Pre-Chorus]

[Chorus]

[Bridge]
Are we there
Is this love
Is this a space race
That we're both part of

[Chorus]Embed"
441,Bridge Over Troubled Water,"Bridge Over Troubled Water LyricsWhen you're weary
Feeling small
When tears are in your eyes
I will dry them all

I'm on your side
When times get rough
And friends just can't be found
Like a bridge over troubled water
I will lay me down
Like a bridge over troubled water
I will lay me down

When you're down and out
When you're on the street
When evening falls so hard
I will comfort you
I'll take your part
When darkness comes
And pain is all around
Like a bridge over troubled water
I will lay me down
Like a bridge over troubled water
I will lay me down

Sail on Silver Girl
Sail on by
Your time has come to shine
All your dreams are on their way

See how they shine
If you need a friend
I'm sailing right behind
Like a bridge over troubled water
I will ease your mind
Like a bridge over troubled water
I will ease your mindEmbed"
