,song_name,song_lyrics
253,The Heart of Every Girl,"The Heart of Every Girl LyricsIn the heart of every girl
There's a woman waking up
Like sunlight spreads across the world
A smile for us is just enough
But in the heart of every girl
There's a homespun family dream
A light that's filled with so much joy
From a curly-head beauty to a teenage queen

And honeymoons in summer prove
We'll always love a bride
The gift you give us all
Is the one you hold inside
This lucky life, this crazy mixed up world
Is all because we love what lives
In the heart of every girl
In the heart of every girl
There's always room for Valentines
And boys to kneel and tip their hands
With words as sweet as summer wine
And in the heart of every girl
There is a rose for every spring
A peach that's fragrant and divine
She shines just like a wedding ring

And honeymoons in summer prove
We'll always love a bride
The gift you give us all
Is the one you hold inside
This lucky life, this crazy mixed up world
Is all because we love what lives
In the heart of every girl

Eyes can light up any room
The moment she steps in
Intoxicating everyone
A life alone should be a sin

And honeymoons in summer prove
We'll always love a bride
The gift you give us all
Is the one you hold inside
This lucky life, this crazy mixed up world
Is all because we love what lives
In the heart of every girlEmbed"
254,Medley (Yell Help/Wednesday Night/Ugly),"Medley (Yell Help/Wednesday Night/Ugly) LyricsYell help, too many cooks and a bird in the bush, yell help
Yell help, if your mirror busts and your cat gets cussed, yell help

Because down the road you find someone else who's looking
Down the road you find another sweet lady cooking
So i gotta yell help

Yell help, some shelter from the storm like the travel agent warned
Yell help, if you can help your superstitions they gonna keep you warm

Because down the road you find someone else who's looking
Down the road you seen another sweet lady cooking
So i gotta yell help

I wish tonight wasn't wednesday night
I wish it wasn't the thirteenth of july (yell help)
And you're looking at the guy whose eyes can't deny
That he wishes he were somewhere else tonight (x2)
Well i met this woman down in new orleans
Lord she built just like a dream
Even wore stockings that had seams
And she was ugly
Now hell i don't mind women of her kind
I'll even pay sometimes for a woman that's ugly
She built like a steamroller
Just the kind to mow you over anytime
Hey the moment might arrive

On bourbon street
Well the ugliest woman you'll ever meet
But she's mine all mine and she's ugly
So i better yell help

[Outro]
Yell Help!Embed"
255,One Horse Town,"One Horse Town Lyrics[Verse 1]
Saw a Cadillac for the first time yesterday
I'd always seen horses, buggies, bales of hay
Because progress here, don't move with modern times
There's nothing to steal
So, there's not a great deal of crime

[Chorus 1]
It sure is hell living in a one horse town
There's half a mile of Alabama mud bed ground
Nothing much doing of an afternoon
Unless you're sitting in a rocking chair, just picking a tune

[Chorus 2]
And they aren't too well acquainted with the stars and stripes
But if you want to hear Susanna, then they'll pick all night
They'll pick all night
[Verse 2]
Because it's no dice living in a one horse town
Laid back, as my old coon hound
And I just can't wait to get out of this one horse town
There's nothing to steal cause there's simply nothing much around

[Chorus 2]

[Chorus 1]Embed"
256,Whispers,"Whispers Lyrics[Verse]
Look at me twice with wildcat eyes
Promise me everything except a blue night
Shudder like ice in cut crystal glass
Melt in embraces of crazy eyed past
And whisper, whisper, whispering whispers
Tantamount to a lie with lingering breath
Walking fingers run, hungry scratches left
Dull chimes ringing like an empty voice
A distant smile framed, her lips are soft and moist
With whispers, whispers, whispering whispers
And whisper in a rhythm your lies
Keep comfort for others
Hurt me with the night
Whisper like cold winds close to the bone
Save heaven for lovers, leave me alone
With your whispers, whispers, whispering whispers[x2]Embed"
257,Lies,"Lies Lyrics[Verse 1]
Some lie about who they love
Some lie about the truth
Some lie to save their lives
Some lie about their youth

[Verse 2]
Some lie about age and beauty
The conquest of sex
Most lie about the night before
A woman lies for a party dress

[Pre-Chorus]
I've lied for a stolen moment
I've lied for one more clue
I've lied about most everything
But I never lied to you
[Chorus]
And we lie, lie, lie
On a streetcar named desire
Oh we lie, lie, lie
For that sweet bird of youth
I could be great like Tennessee Williams
If I could only hear something
That sounds like the truth

[Verse 3]
Some lie in the face of death
Some lie about their fame
Some kneel and lie to God
Some lie about their name

[Verse 4]
Some lie in words and speeches
With every living breath
The young lie with their guitars
The old lie for a little respect

[Pre-Chorus]
I've lied to lie with danger
I've lied for a drug or two
I've lied about most everything
But I never lied to you
[Chorus]
And we lie, lie, lie
On a streetcar named desire
Oh we lie, lie, lie
For that sweet bird of youth
I could be great like Tennessee Williams
If I could only hear something
That sounds like the truth

[Pre-Chorus]
I've lied for a stolen moment
I've lied for one more clue
I've lied about most everything
But I never lied to you

[Chorus]
And we lie, lie, lie
On a streetcar named desire
Oh we lie, lie, lie
For that sweet bird of youth
I could be great like Tennessee Williams
If I could only hear something
That sounds like the truthEmbed"
258,House,"House Lyrics[Verse 1]
This is my house
This is where I live
That is the winter
Those are the trees
I can hear them breathe

[Chorus]
This is my bed
This is where I sleep
That was the dark
Those are my dreams
They belong to me

[Verse 2]
This is my floor
This is where I lie
This is a square room
That was a bright light
These are not my eyes
What is my soul
Where is my tired heart
That is the question
Where is the answer
Inside my house
And I sit by the window
And I wish I was rain
I want to fall from the sky
I want to get wet all over again
Because this my house
It belongs to me
Inside my head
It's all that's left
This is my house
[Chorus]

[Outro]
This is my house[x4]Embed"
259,Dixie Lily,"Dixie Lily Lyrics[Verse 1]
Showboat coming up the river
See her lanterns flicker in the gentle breeze
I can hear the crickets singing in the evening
Old Dixie Lily moving past the cypress trees
My little boat she rocks easy
I've been catching catfish in the creek all day
Oh and I've never seen ladies like those on the big boats
Must be fancy breeding lets you live that way

[Chorus]
Dixie Lily, chugging like a grand old lady
Paddles hitting home in the noonday sun
Ploughing through the water with your whistles blowing
Down from Louisiana on the Vicksburg run
[Verse 2]
Papa says that I'm a dreamer
Says them skeetas bit me one too many times
Oh but I never get lonesome living on the river
Watching old Lily leave the world behind

[Chorus][x2]Embed"
260,Seasons,"Seasons LyricsFor our world, the circle turns again
Throughout the year we've seen the seasons change
It's meant a lot to me to start anew
Oh the winter's cold but I'm so warm with you
Out there there's not a sound to be heard
And the seasons seem to sleep upon their words
As the waters freeze up with the summer's end
Oh it's funny how young lovers start as friends
Yes it's funny how young lovers start as friendsEmbed"
261,Hymn 2000,"Hymn 2000 Lyrics[Verse 1]
She chose the soft center
And took it to bed with her mother
And the ideal confusion
Was just an illusion
To gain further news of her brother
And the comfort of mother
Was just an appeal for protection
For the cat from next door
Was found later at four
In surgical dissection

[Chorus x2]
And I don't want to be
The son of any freak
Who for a chocolate center
Can take you off the street
For soon they'll plough the desert
And God knows where I'll be
Collecting submarine numbers
On the main street of the sea
[Verse 2]
The Vicar is thicker
And I just can't see through to him
For his cardinal sings
A collection of hymns
And a collection of coins is made after
And who wrote the Bible
Was it Judas or Pilate
Well one cleans his hands
While the other one hangs
But still I continue to stand

[Chorus x2]
And I don't want to be
The son of any freak
Who for a chocolate center
Can take you off the street
For soon they'll plough the desert
And God knows where I'll be
Collecting submarine numbers
On the main street of the seaEmbed"
262,Whipping Boy,"Whipping Boy Lyrics[Verse 1]
You're cruel, you do
You do, you do me wrong
You hurt me, you flirt with
Any old face that comes along

[Chorus]
But I won't be your whipping boy
No I won't be your whipping boy
Break me like a little toy
Run me till my feet are sore
But I won't be your whipping boy

[Verse 2]
You're wild, you're sly
What you done to me
I was thirty, I look like fifty
But I feel like sixty three
[Chorus]

[Verse 3]
It's this illegal kind of loving
That keeps my motor running
From the start to the finish line
It's a trashy kind of me that likes to believe
That I'm still trying, I'm still trying
I'm still trying, yes I'm trying
You're dirty, but you're worth it
But you're way, you're way too young
I could do time if they found out
Look out, San Quentin here I come

[Chorus]

[Outro]
I won't be your whipping boyEmbed"
263,Whenever You’re Ready (We’ll Go Steady Again),"Whenever You’re Ready (We’ll Go Steady Again) LyricsI lived in a tenement six floors above
I lent you my records and I lent you my love
But you left me on the weekend without a by-your-leave
That's a dirty and a low-down trick
My folks all think you're mean

But I don't mind, that's kind of nifty
You always set those break-ups in the movies
And just like a light honey you put me out
Now I'm gonna do my best
To get you back in the nest you came from

You can erase me if you want to
Turn your back in other men
But whenever you're ready
Honey, we'll go steady again
It's nasty without you in my little room
I miss you like crazy, please come back soon
I was joking with those things I said
I couldn't have been thinking
If you don't come back I think I'll crack
Just like my old ceilingEmbed"
264,The North,"The North Lyrics[Verse 1]
Have you seen the North
That cold grey place
Don't want its shadow anymore
On my face
A man grows bitter
We're a bitter race
Some of us never get to see
A better place
In the Northern Skies
There was a steel cloud
It used to follow me around
But I don't see it now
There's a farm in the rain
And a little farmhouse
There were a young man's eyes
Looking south
[Chorus 1]
The North was my mother
But I no longer need her
You trade your roots and your dust
For a face in the river

[Chorus 2]
And a driven rain that washes you
To a different shore
There's a North in us all
But my North can't hold me anymore

[Chorus 1]

[Chorus 2][x2]Embed"
265,The Ballad of Blind Tom,"The Ballad of Blind Tom Lyrics[Verse]
""Say that boy's a wonderment""
""No! The kid's a freak""
But that kid he don't care none
His black hands resting on the keys
Hopping like a big old frog
And hissing like a train
Entertaining royalty
All points east, west and in-between
General he's a fine old man
Treat him like his own
""Boy wouldn't know from money""
Just throw old Blind Tom a bone
From the times of King Cotton
May we present to you
All you Jim Crow monkeys
From Harlan County down to Tuscaloo
Pay me anything you like
I'll pay it back to you
Be careful what you call me though
Some things cut clear on through
I may be an idiot
I may be a savant
I didn't choose this life for me
But it's something that I want
Cocks that old big head aside
Grunts a word or two
Keeps them guessing every night
Is he really going to make it through
Faint hearts with their fans out
Starched collars and cigars
He weren't no use for slaving
""I wouldn't want him in my yard""1Embed"
266,Durban Deep,"Durban Deep Lyrics[Verse 1]
I won't see you until Christmas
I breathe coal dust, I get blisters
But the foreman he don't worry
He say work, boy, there's no hurry
Don't that big red sun
Look a lot like fire
When you come out of the ground
After 48 hours

[Refrain]
Going down down down down down
Going down in Durban deep
Going down down down down down
There's no mercy in my sleep
I just hear that drill and hammer
I feel the killing heat
Going two miles down to the heart
Of Durban deep

[Verse 2]
I was born on amen corner
I pound rock face, I get lonely
But my family, they go hungry
Sill the boss man he call us lazy
Don't the old blue heaven
Look a lot like your eyes
When you're blinded by the brightness
Of the Transvaal sky

[Refrain]
Going down down down down down
Going down in Durban deep
Going down down down down down
There's no mercy in my sleep

I just hear that drill and hammer
I feel the killing heat
Going two miles down to the heart
Of Durban deep
[Guitar Solo]

[Refrain]
Going down down down down down
Going down in Durban deep
Going down down down down down
There's no mercy in my sleep

I just hear that drill and hammer
I feel the killing heat
Going two miles down to the heart
Of Durban deepEmbed"
267,I Never Knew Her Name,"I Never Knew Her Name Lyrics[Verse 1]
Well, she swept through the church
Like a sweet Sunday prayer
While the choir sang ""Son of Heaven""
And the groom just walked on air

I was killing time with Jesus
When the wedding bells began
And I saw the most beautiful woman
Getting married to a handsome man

[Chorus 1]
She walked like a mystery
And she passed like summer rain
And she said ""I do"" like an angel
But I never knew her name
Oh, the congregation gathered
But in darkness I remained
In love with the bride of a handsome man
But I never knew her name

[Verse 2]
In the shadow of the holy
Oh, I heard my tell-tale heart
Whisper words that never reached her
As her vows were made at last

Oh, the preacher with his blessing
Pronounced them man and wife
And I saw the most beautiful woman
Make a promise to be kept for life

[Chorus 2]
She walked like a mystery
And she passed like summer rain
And she said I do like an angel
But I never knew her name

Oh, the congregation gathered
But in darkness I remained
In love with the bride of a handsome man
But I never knew her name
[Instrumental bridge]
(Ooh-ah!)

[Chorus 2]
She walked like a mystery
And she passed like summer rain
And she said I do like an angel
But I never knew her name

Oh, the congregation gathered
But in darkness I remained
In love with the bride of a handsome man
But I never knew her name

Like a mystery
Like summer rain
And she said I do like an angel
But I never knew her name

Oh, the congregation gathered
But in darkness I remained
In love with the bride of a handsome man
Oh! I'm in love with the bride of a handsome man
But I never knew her name

(Ooh!)
Never knew her name
(Ooh!)
Never knew her name
(Ooh!)
I never knew her name
(Ooh!)Embed"
268,Return to Paradise,"Return to Paradise Lyrics[Verse 1]
It's paradise here where the sun meets the sea
There's nothing to fear and so much to be
But soon I must go, say goodbye to it all
That homeland of mine is beginning to call

[Chorus]
Goodbye doesn't mean this has to be the end
Fading dreams grow cold as ice
And I got a feeling we will meet again
When we return to paradise

[Verse 2]
The wind in our hair and the sun in our eyes
There's no need for tears and no time for lies
So reach out your hand and I'll reach out my heart
Remember me while we are apart
[Chorus][x3]

[Outro]
I'm heading homeward
Leaving sunshine and heading for rain
But we'll return to paradise againEmbed"
269,Recover Your Soul,"Recover Your Soul Lyrics[Verse 1]
Baby you're missing something in the air
I got a name but it don't matter
What's going on? It's cold in here
You have a life but it's torn and tattered
Maybe you're losing pieces of your heart
You have a world but it stopped turning
You lose the day and gain the dark
Love was a fire but it stopped burning

[Chorus]
Spare your heart, save your soul
Don't drag your love across the coals
Find your feet and your fortune can be told
Release, relax, let go
And hey now let's recover your soul
[Verse 2]
Lazy old sunset sinking like a tear
Alone at night in a losing battle
That perfect world is never clear
You have to fight for the things that matter

[Chorus][x2]

[Outro]
Hey now let's recover
Hey now let's recover your soul
And hey now let's recover your soulEmbed"
270,Lady What’s Tomorrow,"Lady What’s Tomorrow Lyrics[Verse 1]
Look up little brother
Can you see the clover
No not over there
A little bit left and over there
Now look and see the lilac tree
The lily pond, the skylark's song
The open air but no one cares
If branches live and die out there

[Chorus]
Remember when you were nine
And I was ten
We would run into the wood
No we never will again
And Lady, what's tomorrow
What's tomorrow anyway
If it's not the same as now
It's the same as yesterday
Yes Lady, what's tomorrow
Will it be the same as now
Will the farmer push the pen
Will the writer pull the plough
[Verse 2]
Look up little brother
Can you see the clover
Oh sorry but it's over
Now there's concrete and no clover

[Chorus]
Remember when you were nine
And I was ten
We would run into the wood
No we never will, we never will again
And Lady, what's tomorrow
What's tomorrow anyway
If it's not the same as now
It's the same as yesterday
Yes Lady, what's tomorrow
Will it be the same as now
Will the farmer push the pen
Will the writer pull the plough
Oh Lady, what's tomorrowEmbed"
271,Cry to Heaven,"Cry to Heaven Lyrics[Verse 1]
I found a black beret on the street today
It was lying in the gutter all torn
There's a white flag flying on a tall building
But the kids just watch the storm
Their dirty faces pressed on the windows
Shattered glass before their eyes
There's a mad dog barking in a burned out subway
Where the sniper sleeps at night

[Chorus]
No birthday songs to sing again
Just bricks and stones to give them
Wrap them up in your father's flags
And let them cry to heaven
No birthday songs to sing again
Just bricks and stones to give them
Wrap them up in your father's flags
And let them cry to heaven
[Verse 2]
There are many graves by a cold lake
As the beds were when your babies are born
And your rag doll sits with a permanent grin
I saw a black cat tease a white mouse
Until he killed it with his claws
Seems a lot of countries do the same thing
Before they go to war

[Chorus]
No birthday songs to sing again
Just bricks and stones to give them
Wrap them up in your father's flags
And let them cry to heaven
No birthday songs to sing again
Just bricks and stones to give them
Wrap them up in your father's flags
And let them cry to heaven

[Outro]
Let them cry to Heaven
Let them cry to Heaven
Let them cry to HeavenEmbed"
272,Tinderbox,"Tinderbox Lyrics[Verse 1]
Nostradamus said, ""I predict
That the world will end at half past six""
What he didn't say was exactly when
Was he listening to the radio?
Was he listening to the government?
Well he got us spooked anyway
We'd been running hot up until today
But a wind of change blew across our sales
We were coasting on a winning streak
We were kings until the power failed

[Chorus]
We've been living in a tinderbox
And two sparks can set the whole thing off
Rubbing up together around the clock
Lately we've been getting more roll than rock
You and me together in a tinderbox (tinderbox)
Two sparks can set the whole thing off
Rubbing up together around the clock
Lately we've been getting more roll than rock
You and me together in a tinderbox
[Verse 2]
Godzilla came in disguise
Tore the building down right before our eyes
Kept the needle out of the red balloon
Was he worried we might go too far
Maybe wind up rhyming moon and June
The sun descends down in Mexico
While a fancy car back on Savile Row
Shows the price of fame leads to overkill
Things are going to have to change
Some holes along the road get filled

[Chorus]

[Verse 3]
Pressure's going to cook us if we don't unlock it
Gun's going off if we don't uncock it
We've got to climb out of the other one's pocket
Or we're going to burn, out on this beautiful rocket

[Chorus]Embed"
273,Long Way From Happiness,"Long Way From Happiness Lyrics[Verse]
I guess you're okay
You seem to feel better these days
I've known you for so long
I've seen your brightness go from blue to grey
You know that's true
You can shake your head but I can prove
I've seen things through your eyes
You think you win but in the end you lose

[Chorus]
And there's no second guess
We take no second bets
Chances are we're a long way from happiness
Don't cover up the road to love
With words that can't express
The truth implies you're high and dry
And you're a long way from happiness
[Bridge]
I'm one step behind
Looking out for you all the time
I'll put my faith in you
And steer you clear of love that leaves you blind

[Chorus][x2]Embed"
274,Amazes Me,"Amazes Me Lyrics[Verse 1]
You're a cool little one
My dark southern breeze
Sweeps through my fingers
And it amazes me
Dixie shadowland
Your envy shelters me
Lay down your burden
Mystery of ebony

[Chorus 1]
And it amazes me
Oh! It amazes me
Maybe the heat babe could be this tune
It amazes me
It amazes me
What drives me crazy
Is that big fat yellow moon
[Verse 2]
Look up that pale light
Well she's waking the trees
I'm drifting in your hoodoo
And it amazes me
That magnolia state
Got a hold on me
I got no blues to preach
Just Mississippi company
There is no magic potion
No gri-gri on her side
She's bound to my salvation
Sweet little mama
Take me down by the river tonight
And it amazes meEmbed"
275,Look Ma No Hands,"Look Ma No Hands Lyrics[Verse 1]
I'll take a rainy day
To make a champagne shower
Poach some horn and tusk
To build an ivory tower
Been to Philadelphia
The day it was closed
I walked to New Orleans
Down a Louisiana road

[Chorus 1]
The skeletons they hung from the bushes and the trees
But not a skull among 'em said boo to me
In a time of wine and cheap cigars
I'm on top of the world
Top of the world Ma
[Chorus 2]
Look Ma no hands
Look Ma ain't life grand
I'm a super power, I'm a handy man
Didn't I turn out, didn't I turn out to be
Everything you wanted Ma
Ain't you proud of me

[Verse 2]
It takes a silver tongue
To have the Midas touch
Not your alchemist
Making gold from rust
Been down in Roswell
When the Martians came
I sailed to Mandeville
Across Lake Pontchartrain

[Chorus 2]

[Chorus 1]

[Chorus 2]

[Outro]
Didn't I turn out, didn't I turn out to be
Everything you wanted Ma
Aren't you proud of me1Embed"
276,Pain,"Pain Lyrics[Verse 1]
What's your name?
My name is pain
Where do you live?
I live anyplace
Where were you born?
In the state of fear
How old are you?
Nineteen hundred and ninety-four years

What's your plan?
My plan is pain
When will you leave?
I'll never go away
How will you breathe?
You'll give me life
How will you see?
Sitting in the temple right between your eyes
[Chorus]
My name is pain
You belong to me
You're all I wanted
I'm all you'll ever be
From the beginning
In a world without end
I am the air
I am pain

[Verse 2]
Pain is love
Pain is pure
Pain is sickness
Pain is the cure
Pain is death
Pain is religion
Pain is life
Pain is television

Pain walks
Pain crawls
Pain is peace
Pain is war

Where were you born?
In the state of fear
How old are you?
Nineteen hundred and ninety-four years
[Chorus]
My name is pain
You belong to me
You're all I wanted
I'm all you'll ever be
From the beginning
In a world without end
I am the air
I am pain

[Chorus]
My name is pain
You belong to me
You're all I wanted
I'm all you'll ever be
From the beginning
In a world without end
I am the air
I am pain

From the beginning
In a world without end
I am the air
I am pain

I am pain
I am pain
I am pain
I am painEmbed"
277,Passengers,"Passengers Lyrics[Chorus]
Deny the passenger, who want to get on [x3]
Want to get on
He want to get on
Want to get on
He want to get on

[Verse 1]
To make a chain of fools
You need a matching pair
One hypocritical fool
And a crowd that's never there
There's anger in the silence
There's wheels upon the jail
A black train built of bones
On a copper rail
[Chorus]

[Verse 2]
Company conductor
You need the salt of tears
Falling on a ticket
That no one's used in years
Non-commercial native
It's tattooed in your veins
You're living in a blood bank
And riding on this train

[Chorus]

[Verse 3]
The spirit's free, but you always find
Passengers stand and wait in line
Someone in front and someone else behind
But passengers always wait in line1Embed"
278,Dear John,"Dear John Lyrics[Verse 1]
I got home today, took a look around
Trying to find that girl of mine, she could not be found
All her things were gone, she just left a note
It don't take no mastermind to figure what she wrote

[Chorus]
She said, ""Dear John, I'm moving on
By this time I'm going to be long gone
Dear John, c'est la vie, dear John
So long, you've seen the last of me""

[Verse 2]
I don't want her back, I won't even try
This time isn't just au revoir, this time it's goodbye
We could not go on, living like we were
I was just about to write a 'Dear John' note to her
[Chorus]
I was going to say, ""Dear John, I'm moving on
By this time I'm going to be long gone
Dear John, c'est la vie, dear John
So long, you've seen the last of me""

[Chorus]
She said, ""Dear John, I'm moving on
By this time I'm going to be long gone
Dear John, c'est la vie, dear John
So long, you've seen the last of me""

[Chorus][x2]
Dear John, I'm moving on, by this time I'm going to
Be long gone, dear John, c'est la vie, dear John, so long
Dear John, I'm moving on, by this time I'm going to
Be long gone, dear John, c'est la vie, dear John, so longEmbed"
